

ericksun@192.168.56.101:~/workspace/pika_0.10.0 (master)$ python3.5   -m test.receive


注意这里有个git记录


tcpkill 验证rst报文

root@192.168.56.103:~/myproject# tcpkill -i enp0s8 src port 5672 and dst port 49154 and src host 192.168.56.103 and dst host 192.168.56.101
tcpkill: listening on enp0s8 [src port 5672 and dst port 49154 and src host 192.168.56.103 and dst host 192.168.56.101]
192.168.56.103:5672 > 192.168.56.101:49154: R 1323613767:1323613767(0) win 0
192.168.56.103:5672 > 192.168.56.101:49154: R 1323614002:1323614002(0) win 0
192.168.56.103:5672 > 192.168.56.101:49154: R 1323614472:1323614472(0) win 0
192.168.56.103:5672 > 192.168.56.101:49154: R 1323613775:1323613775(0) win 0
192.168.56.103:5672 > 192.168.56.101:49154: R 1323614010:1323614010(0) win 0
192.168.56.103:5672 > 192.168.56.101:49154: R 1323614480:1323614480(0) win 0
192.168.56.103:5672 > 192.168.56.101:49154: R 1323613775:1323613775(0) win 0
192.168.56.103:5672 > 192.168.56.101:49154: R 1323614010:1323614010(0) win 0
192.168.56.103:5672 > 192.168.56.101:49154: R 1323614480:1323614480(0) win 0


